{
  "$schema": "https://json-schema.org/draft/2020-12/schema",
  "$id": "monty-pod/contracts/pod_job.schema.json",
  "title": "PodJob — control-plane→pod typed EventStream job",
  "description": "The payload of one typed EventStream job frame, dispatched on type. request is an InferRequest (infer_request.schema.json); spec is a RenderSpec (spec.schema.json); chain is an OpChain — a DAG of declared operations (op.schema.json + ops/*.json) run on ONE box with local-disk handoff between steps. Each carries its own version const (infer_version/spec_version/chain_version) — this envelope has none, contracts/VERSION stays the single pin for all three.",
  "type": "object",
  "additionalProperties": false,
  "required": ["type", "session_id", "corr_id"],
  "properties": {
    "type": { "enum": ["infer", "render", "ops"] },
    "request": {
      "description": "Present iff type=infer. Opaque here — validated against infer_request.schema.json.",
      "type": "object"
    },
    "spec": {
      "description": "Present iff type=render. Opaque here — validated against spec.schema.json.",
      "type": "object"
    },
    "chain": {
      "description": "Present iff type=ops. Opaque here — each step's params are validated against that op's own schema fragment in ops/<op>.json, read by BOTH sides. Deliberately not expanded inline: a per-op block here would be exactly the hand-mirrored surface the op registry exists to abolish.",
      "type": "object"
    },
    "session_id": {
      "description": "Required pod-lane key (=tenant/session). One warm pod per session serves all its jobs; the pod echoes it on lifecycle events and terminals.",
      "type": "string",
      "minLength": 1
    },
    "corr_id": {
      "description": "Required per-request correlation id set by the worker at enqueue. The pod ECHOES it verbatim on every result/terminal, providing both result demux and replay dedupe without a positional fallback.",
      "type": "string",
      "minLength": 1
    }
  },
  "allOf": [
    {
      "if": { "properties": { "type": { "const": "infer" } }, "required": ["type"] },
      "then": { "required": ["request"], "not": { "anyOf": [{ "required": ["spec"] }, { "required": ["chain"] }] } }
    },
    {
      "if": { "properties": { "type": { "const": "render" } }, "required": ["type"] },
      "then": { "required": ["spec"], "not": { "anyOf": [{ "required": ["request"] }, { "required": ["chain"] }] } }
    },
    {
      "if": { "properties": { "type": { "const": "ops" } }, "required": ["type"] },
      "then": { "required": ["chain"], "not": { "anyOf": [{ "required": ["request"] }, { "required": ["spec"] }] } }
    }
  ]
}
