{
  "type": "render",
  "session_id": "tenant_7a1e",
  "corr_id": "9c3f5b2e8d1a4f60b7c8d9e0f1a2b3c4",
  "spec": {
    "spec_version": 7,
    "job_id": "job_9f2c1a",
    "slug": "demo-clip",
    "mode": "preview",
    "inputs": [
      {
        "id": "src",
        "kind": "video",
        "sha256": "a3f54e21b0c9d8e7f6a5b4c3d2e1f0a9b8c7d6e5f4a3b2c1d0e9f8a7b6c5d4e3",
        "url": "https://storage.example/o/14311.mkv?sig=GET"
      }
    ],
    "timeline": {
      "fps": 30,
      "width": 1080,
      "height": 1920,
      "segments": [
        {
          "src": "src",
          "in": 12.333,
          "out": 18.9,
          "speed": 1.5
        }
      ]
    },
    "encode": {
      "video": "h264_nvenc",
      "preset": "p4",
      "cq": 29,
      "pix_fmt": "yuv420p",
      "audio": "aac",
      "audio_bitrate": "192k"
    },
    "outputs": [
      {
        "id": "proxy",
        "kind": "proxy",
        "put_url": "https://storage.example/o/43842.mp4?sig=PUT"
      }
    ]
  }
}
